,Class,Utterance
495,anger,thescame makes no sense
496,anger,we both oudition for the part and the as it turned out
497,anger,fast i
498,anger,han also am i'd be far away in the sea
499,anger,o ca when
500,anger,she's in labour you like that you sick son of a bench
501,anger,no you can you can't leave me here with them or maybe say
502,anger,efore you know it she's with him
503,anger,at m en to sitt here silently while the three who have a copper seat
504,anger,ofor god's sake we to let it go there's no rightel
505,anger,rots you got a stop o q you carn't you stare through the people for three hours you canbe get feet by
506,anger,your big scr
507,anger,not after this
508,anger,sus me man just l spinger it out on a tree
509,anger,well ball out of it
510,anger,nod else i p it amiss
511,anger,fackin e dollsiter a
512,anger,
513,anger,jollyc i kimpy i gring you her to see the bapstaine kane commet one of nature's most spectacular phenomena and all you care about of blods stuck in torren and some woman
514,anger,why don't you think of some one else for a change
515,anger,but i  i was just frying to make a good first impression
516,anger,come on mandy you can dancle my parner she's out she's real mellow
517,anger,they didn't take any of my suggestions
518,anger,n i go to wist
519,anger,i monica's maid of honour a  don't try to blo pin me  well what to do with these things things look nice so they are nice
520,anger,pevy knows and she just been a weakest out that's the only explanation for it
521,anger,and you were getti to us  you think you are gointo get away with that i doit ovyou i
522,anger,oh cat sow just because it was my table i have to buy a new
523,anger,oh your mamma probably won't kill yourself oi'm sorry but i'm not hanging anl m
524,anger,you te plan plannd to get ofer my man
525,anger,no no hes how no why try to ruin the gane which brings us back of course to gaily's theory adopt
526,anger,this is not asit not a marriage this is the world's worst hang overmarthlisten if you do not get this anoment i will
527,anger,ealike  dead
528,anger,at he oud o
529,anger,you have been storing us all day
530,anger,or if that's it get off get offa
531,anger,hreally that's what my daughter means to you nothing
532,anger,everyone will live you
533,anger,we were on a brag now we weare what happen to you
534,anger,i am not getting in a car with ross we will just have to live here
535,anger,lemented seeting my ass i   a  to see him with the kite
536,anger,i'll get at ter fore and went went wisee on lk
537,anger,we fount your far along and trasu
538,anger,let's go big money
539,anger,o capable of i get ow my pinchable bot an my bulging biceps she knows sijeoe
540,anger,damn it fee b
541,anger,and be waited until the last minute so that i sint here
542,anger,i can't believe you put that on my olumn i pay
543,anger,at i gat it o why
544,anger,why do you want to get the birds get the bird
545,anger,i didn't even think oftout man ah that your drawjec
546,anger,i highly doubt thatsapoen
547,anger,my sandwach
548,anger,of what you stupid its been three hours is that all
549,anger,begin friendling
550,anger,were not drawn it away i built that canoe
551,anger,
552,anger,bout goingout wi that girl way
553,anger,wat are you talking about gross and jou said that you read it twice
554,anger,but why don't you tell me what youesupposed to be
555,anger,kind of scerios clowns came to yeurburg o
556,anger,was body of in
557,anger,a as you do ut i know mis us unbelieve i
558,anger,ud you say a
559,anger,i get ther  i get that big time and i'm happy fore you but i'm tied of having a relationship with your answering sh
560,anger,now could you made some sort of inappropriate jo
561,anger,ha i am not quinin i am going to finish this jern all right or right if you insist on doing this at least let me hemp him
562,anger,jailer he's your father he should be at your wedding
563,anger,and if any yeu dont understand how important this is to me well then perhaps we shouldn't be getting married at all or
564,anger,and last years at why you sent us to that mity times restorats
565,anger,see everybody else is happ a she's done
566,anger,pay i offer to marry her
567,anger,hey started my bars
568,anger,this year was supposed to be great
569,anger,fonny
570,anger,ere the lovely emande gives me her number and ay ay go and drop
571,anger,has now rachel
572,anger,you apologize the tre right now or i am calling torbacco
573,anger,miga
574,anger,then ye as cause phebe ma so you don'ts either her  metoo
575,anger,ane respects the bucket
576,anger,it will excuse me if i wanting to be with my girl friend on our anniversary boy wouldn't assi my
577,anger,o disturbing my obo practice
578,anger,on the other hand if she wasn't kitting she's not fun she's stupid and tid im a race
579,anger,
580,anger,wpheby did you whip up brossnaids larg
581,anger,happy is that what i'm supposed to be thire
582,anger,o sudden excuse pulld on a sircan this is my friend's machine
583,anger,especially by that professor we ran til last night judging van holier than that
584,anger,we were in high school i made out with james sparrow even though i knew that you like
585,anger,i'm sorry my friends are at sophisticated as yours
586,anger,well you sock but at least you suck et a man's game now
587,anger,do ten o sa don you cetti gava
588,anger,i don't thirt no di get married anyway
589,anger,i fonhy crazy with that
590,anger,you wake my candy bog
591,anger,peter you said it was urgent
592,anger,do know
593,anger,and you'll be all oh man
594,anger,onone the thing you
595,anger,i
596,anger,that's young man i am
597,anger,with a hill
598,anger,torti tot the first cless to get syou got the loungd
599,anger,why to celebrate your relationship to solidify your commitment to declare your love for one another to the world
600,anger,i i was wondering is it possible to increase security an thepaleintolligen section
601,anger,not even a song
602,anger,this is exactly the kind of thing that makes her think you that has love me more than alove her
603,anger,this is my home i want to be able to comi dull whenever i want
604,anger,look for you
605,anger,asin would you graduate high school
606,anger,is called the bapstin chin commed awaway ha thapstin was a very well respected a
607,anger,because a fictures os to say geler and bean to be marrie nights wo the woman savs drowning more on  don't laugh at him
608,anger,ow
609,anger,a i car fol rol my wor do
610,anger,of tlaw
611,anger,in a heart weeny to move an
612,anger,i don't care the wires have come loosing your head
613,anger,no yuguyvs i'm not getting in a card with him you'll have to think of something else
614,anger,o k you don't think i thought of that
615,anger,do this is a funny
616,anger,wonl ga break up still ar
617,anger,onco u don't even have a bed you sleep and a ball in the floor
618,anger,on nowing there
619,anger,ord you hang up on me ill marry you and me right now i have the power
620,anger,ai nati put oar
621,anger,now than was fall
622,anger,no ujust a couple more boxes
623,anger,i thought i judg you thagain atin air
624,anger,ok o
625,anger,walls are pretty thing dies
626,anger,just tik gettin worse and worse
627,anger,to belum
628,anger,o have a liar
629,anger,it is so unfair
630,anger,lant morm for the malett
631,anger,the rail the wedding is back ine
632,anger,i don't want to i want a chiss jolly
633,anger,i'm an a caldal landlord and tell him that monica is yildegly sublet in her grandmother's apartment
634,anger,o ka o cana what is wrong with my snuggles
635,anger,
636,anger,jon harrisand ey
637,anger,i can't prove it yet but when i do you'll be going to jail for murder
638,anger,on hundred even thinking about thesens
639,anger,no were not
640,anger,i don't care i am trying to get a pri out of my body and you're not making uneasier abow
641,anger,don't you follow me
642,anger,don't laugh at him
643,anger,no yet the groom cannot sey the bride
644,anger,o ei really is it ros y hey well let me just make the little easier for you e
645,anger,and an taper cin to make it all the way over here uponi
646,anger,choman i'll ive you ten free raft lorincer
647,anger,you know i dont name pelic i know you any more man
648,anger,ant you all jealo
649,anger,yes ow then up they'll committ nos do now give me my
650,anger,igood as at an a do repu
651,anger,nno o no and living and do di you can't touch the paintings
652,anger,wi gov chailer the one you picked is gone it's over
653,anger,but he shudder sochill ever do that again
654,anger,tailor please don't think i was trying to press yure you phoebe and rachel just thought fo bein rachel
655,anger,ovin easiall taste like your grandma
656,anger,mew pick one just pick one here about that one
657,anger,so i can te just stumble across the hall and sleep wit the first sky i find in there
658,anger,r who went down to the uasas nimets and sold him a two thousand boxes
659,anger,shut up you know it's a rebuilding yat you wha y
660,anger,to tegetan sorbrits
661,anger,why not my children jran ldren
662,anger,but micha is who interested in you thats hergaand i have been able to say two words to each other io ho on ontice aphere silently while the dreams have a conversaton
663,anger,could you not give me the message
664,anger,
665,anger,no no i didn't come wit her
666,anger,you know i'm an it was really exciting at first but now it's i o cae so where are we got to eat eer
667,anger,ye may in out here ashamed o my book
668,anger,ai do not dump richels nor are we still together awhere we just let the machine get that
669,anger,a trait and copeo can ha
670,anger,my geta  who
671,anger,sirry is to like the idea o what i'm saying i do he's thinking no i'd do er too
672,anger,or so you win o q
673,anger,am sorry is that you'r masking yes really pretty unfortunately i don't see sin
674,anger,on telling you he's dead wu were abound to have here as a dead fat guye on a stick
675,anger,the il take you right now blunny you migt go
676,anger,don allys a mat funny it's physically impossib
677,anger,i know a ta tha agiain
678,anger,get o ma that you starty this you will finish
679,anger,so i called the father and ask him to make i your sukacallip go
680,anger,i the oen i ran my yen
681,anger,you look at me and it's nothing
682,anger,my my goun i don't get bond messages from interesting people mer
683,anger,jo that e n
684,anger,for what for lettin you throw me out of your office
685,anger,a try i you made me feel really guil
686,anger,but not about this
687,anger,ousi
688,anger,oi
689,anger,and that's all because it's right dail when you turned it on
690,anger,do you think manica realizes how much of herent spent on this weady
691,anger,can't believe it can i tell you some i'm a little man at him now
692,anger,no dovna because it is not true
693,anger,no i knowt i don't need them im bad you nice now as friends you wuln sus im
694,anger,o gorate that special bond again
695,anger,sam had hire the girl o cat everybody ready
696,anger,you really want to talk about getting people they like you ha funny man
697,anger,i  you should even be here iss a schoolnight
698,anger,my glad i doll away stop loking in we are
699,anger,because i sure herself can't figure it out
700,anger,le thinking me ta o  i don't care
701,anger,mijell if you goll you're just get a midst of his head and ruin his wet in
702,anger,my ask wife witney is out there i cannot deal with the right now that one is crazy oh i no called up
703,anger,it was the ring
704,anger,hhends on me e e ma
705,anger,not the same thing this is totally different
706,anger,
707,anger,better do something or i'm no walk out that door right now well are you got up
708,anger,otherwise you're just mean
709,anger,look all my ston is safe and dry and all herstuffin is moi growing no stuff
710,anger,right right a min it's pretty unbelievable you know i'm in der just tok off tok o lettin look back
711,anger,jo joy joy jo
712,anger,thayt youjust had rot
713,anger,ocare
714,anger,i am strong i'll show you
715,anger,john mc lan had plans
716,anger,sa rush which a prom
717,anger,just taking you outside
718,anger,why now you sayin in it stuff like thats which a wir w
719,anger,let me asked for something how come when i call your computer support line i have to wait an hour and a half
720,anger,thank you
721,anger,carryi nit ga again
722,anger,russ is so crazy about you and i really wanted you to like me and i it's probably me just being totally parinoyd but i
723,anger,at the fount time
724,anger,barlelen what kind of a party serves barley
725,anger,how can she be great is she's from peghipsy ay that jo wulda killed and all tha
726,anger,the judge wouldn't let us get in a moment now we got to got at the bards then a push throw up on you
727,anger,because every time i go to the denis somebody dies
728,anger,i do i
729,anger,well this is my sickness
730,anger,i it wis my idea
731,anger,i can't talk to you i don't have a fancy ad the yellow pages
732,anger,thatin arrogance
733,anger,not nice a non
734,anger,more like him than you do
735,anger,when to go down there and teach that guy i le
736,anger,takin just pick one so i and watch them have a perfect magical weaken together with ege
737,anger,i fren still tamery
738,anger,richel things could get incredibly complicated
739,anger,why would you please pay attention i could wake up at any more
740,anger,no no neme do i speak to sonly charge please
741,anger,told this guy that i was looking for a fling don't tell the guy thats boi
742,anger,
743,anger,paston very cn
744,anger,like did
745,anger,you said you wal but you never dad
746,anger,o wat u believe wuld pewle put in here
747,anger,is at a secret or a lie
748,anger,ve i asked you to gord the ring we now i'm sorry
749,anger,
750,anger,it was my or
751,anger,so listend i went across the street and talked to the doorman i got the paper's name can i use the
752,anger,
753,anger,so so you're making porn modes no i'm not
754,anger,really think so i don't
755,anger,o just the second no no li
756,anger,oh well you hangin there teddy
757,anger,no no no not a richard thing just put down the glass and get out
758,anger,i don't lutt to make any mistakes
759,anger,i han't leave it you gouch a hole in my dingy floor
760,anger,etract of the yew lards of the yew have
761,anger,i have to say i don't really care for your tone
762,anger,ry well to sif the paste matches the pats  to make yourself a pair of pase pats at you on jom jou have an in it
763,anger,look at marri
764,anger,o some on a little rangumacause they have to do it in a cup o they git you to kinny size
765,anger,i would chill you living dro hate tha mik that my rom is so small
766,anger,chery an yorning bitch athe hndunds no yer horty that jilyr horni ina
767,anger,well i'm keeping so many things to myself these days something was bound to sub out
768,anger,i know that was him
769,anger,o
770,anger,you'll have to do that it's saturday
771,anger,would do stop and only twenty
772,anger,that's yere rachel
773,anger,richel
774,anger,ll right
775,anger,
776,anger,wathe  nia other day o we did hell over your woll wen your father there's im no fa
777,anger,chanler
778,anger,van
779,anger,toke ros tetot
780,anger,hicked up my snap
781,anger,oare any of those people here o no no no
782,anger,percha
783,anger,she feels terrible she really must ae make up you've got to find er
784,anger,ectly i think this apartment sully's the good name e crapped
785,anger,that almost hit me in the face
786,anger,te mi
787,anger,moved a boal further away ros could make that shot ha
788,anger,but ii sent it i put my basket on tom
789,anger,o my sister just invited me to a party to nin he's going to be there
790,anger,bt f i maoies at i could
791,anger,was a noting cracking bother everybot or
792,anger,anybody familiar with the as i shall leven be the help cot that requires all refuge matured and taken out the backex
793,anger,row ou  ol ol ou ou o  ou l  nidl ol hay e wit no tean shipo wa
794,anger,now look i deserve to know where i came from
795,anger,
796,anger,why march
797,anger,clear little breakfast adventure with angeladelpecio
798,anger,oh case so i don't have it all worked out quite yet just don't don't say anything to rachel please rachel is one of my closest friends
799,anger,so it done then
800,anger,ould you tell her that i let you windsleys
801,anger,oh you noi i can't hear that enough
802,anger,sta ye clorse you don't but you are a little princess
803,anger,would he still do it er toll your lobs or rather yoly
804,anger,thieves can't make it got a day taltulater big daddy
805,anger,fee me lookin an
806,anger,different i was drunk and stupid
807,anger,islaminases
808,anger,fi what's on the drake
809,anger,yeh well miss a you better be glad that list is lamonated er
810,anger,that's it
811,anger,can't ask people to do that would you ask people to do that
812,anger,hammitroug wo wo
813,anger,sis because you are looking you fend perfer
814,anger,
815,anger,o i don't kno how i think it heget we thought he could drive from all beny to canada on a half a take a gas
816,anger,phebi an rachel just thought very inrachel
817,anger,sorry joe i didn't think the doctor was going a buy that he just fell out of thi socket
818,anger,tell me you're sorry an that you left
819,anger,and lating som neckatae spend one more day with some one ho's hot to sat to touge my everything
820,anger,
821,anger,well it's not flax right now
822,anger,o
823,anger,out o god a why wouldn't think to check there
824,anger,tough i meethat they're so few genuine by nice guise out now
825,anger,
826,anger,i found the picture
827,anger,ras
828,anger,said the ball is in his court
829,anger,if youare noly without your honeymil
830,anger,would you be reall emotional time you know n youve had a lot to drink and if you coul let that go
831,anger,de how often a tat habit i must never co
832,anger,you fingure gout deat what you wanted than you dune parr like it did rain
833,anger,storming out
834,anger,
835,anger,yhee he calls me up and asks me if he can eddit my new moving
836,anger,i went all over new york city looking
837,anger,oh look at this one what's so beautiful yer oh
838,anger,ist all the fown
839,anger,o a a lin robber your blue whatever ylisten enough hu give me back my ploth  it
840,anger,nothing it's ove camt it this is regularly schedual programme
841,anger,you went through my crystal proverty
842,anger,that's why o got a tivuse to that play to get rad of us
843,anger,ther was no kagroom
844,anger,va sunname jorty ll agree my son's name is jamie wack jenny lisin e vu isn's best
845,anger,oh boy do they suck
846,anger,witem will get wet
847,anger,conjous matn ta
848,anger,lok
849,anger,i you know it
850,anger,no so you are saying that if i called it it wouldn't rain
851,anger,i took them from a hotel lobby and they think they can charge me for some dirty movy and a bag in ma sugar nutes they get another thing come
852,anger,men oo o pomthing in my
853,anger,people are on it
854,anger,o ia telling you it's like watching man by learn how wa
855,anger,su
856,anger,to picturea rato
857,anger,noi ole ev y it's not hot dot
858,anger,yo keep the old ones in the back that is so ages
859,anger,don't call us that
860,anger,rachel's here so good luck man let me know how works ou
861,anger,i don't accept this rule
862,anger,macc  la
863,anger,o spend olf your life in the bax and win you never go on the bloody window
864,anger,er hear you lurker the a get
865,anger,yei ye i give up a jab to
866,anger,why do you have a pecture pull out of your tag
867,anger,can wear that time wearing the famous toxs jane bonstox so
868,anger,o not im just ecaid sally well harring up tiscmmigo bush meself din in the toilet
869,anger,
870,anger,isyor thought is battalli mad to get overer us and move on
871,anger,i said i'll do it nobody wants to do
872,anger,bou sleep
873,anger,ah a great no he knows him i don't kno
874,anger,fan
875,anger,yet believe he'd take the two of them hav isect
876,anger,
877,anger,i'll take you the
878,anger,derogin then
879,anger,otheres some people who do want to merrime
880,anger,yougot to sleep with the ragget the quanc
881,anger,you're the worst best man than ever
882,anger,
883,anger,she moved in with a guy who was secretly married to her and he said he didn't love her but he really did and it just blew up
884,anger,ga
885,anger,and this is not the only hospital in this city and we have no problem woe o
886,anger,ay ith my misery amusing to you
887,anger,i got no crote e e you go   thinkou o e te aa ao e  me better he now
888,anger,y ga  t a chailin i thought we were just gan a ca
889,anger,gros an
890,anger,of all people you do not wa may tell the story
891,anger,causehe talhung up on o
892,anger,it's not a real game i made an
893,anger,
894,anger,what ar you as tollin her
895,anger,ust i just read what you put on your page to day
896,anger,or yous r i say i am stillng it on nybut wages never get a tal
897,anger,my agent would like to know why i didn't show up at the odd dition i didn't now i had to day
898,anger,long orwe at the same table it's like cocktails an appalatia
899,anger,come on more
900,anger,why i man its pretty unbeliever boy
901,anger,and no knows what sience to come up with in the future but chan i what if i die an unsuccessful regular sized man
902,anger,instead my parents got me this little slastic chicken the chik hop around and
903,anger,david's heartill be broken it will be too hard for them to recover from and then fee if he will end alone again ber that's bad advice
904,anger,ahamo the hair comes out glaps
905,anger,i won't till i have my next cigarette
906,anger,that's right you are so bu tin an  to lab but the
907,anger,much against tusiness
908,anger,because vincent we were loveless for two years
909,anger,edeed that is a different fowl
910,anger,ill get monica what r you doing you're got to lose your job this is not you
911,anger,iily
912,anger,you found my
913,anger,was the lantonow would you had a crush on joe y when he was moving in
914,anger,nine and leaving sandaas ben
915,anger,i subnowd
916,anger,t like the ting binan
917,anger,dug do ar gat bage that you
918,anger,yw trainla
919,anger,anor we have talked about this
920,anger,this is a garden view room and we paid for an ocean view
921,anger,i don't knew to guis to care about me
922,anger,you can't leave me with them where were a jame replying as on there get a trouble tea me
923,anger,can't you figure that i am based on my day to birth
924,anger,
925,anger,
926,anger,bine but please god tell me how to start them from going off
927,anger,when we make plans i expect you to show up
928,anger,preaces me and
929,anger,ora
930,anger,jo lookat er you six best
931,anger,o kake because i know that this is my fath
932,anger,mike i did something terrible to you
933,anger,
934,anger,a small puff of air a kind yo
935,anger,ju ree
936,anger,i annot believe that i could spend the last two days chined a figure at the recipenof my pugr evan
937,anger,that guy is always mooching off of us youare
938,anger,now r joy i wite you to be my best man
939,anger,oleg and why ceada gra punk
940,anger,anal i might have some kind of life like ihave been sitting around youre honing for the last two hours
941,anger,i get ap you get at im
942,anger,i's one about you and chan wer er
943,anger,here
944,anger,tescares me playse and trying to have a date here
945,anger,you faulacy
946,anger,ol  o just the person who meads to floft the pillows and pay the bills as soon as they come in
947,anger,these clowns are toying to take us fom ride and i'm not a
948,anger,you aren't there
949,anger,ook i don't have to answer your questions o q i'm a big boy i you do whatever i want
950,anger,et untild he ot to walk here lon there tere bunk
951,anger,ad sprantlin qike three weeks
952,anger,you can't play bagpikes at the wedding
953,anger,rig devit wray
954,anger,but agt does this look like a garbage can to you no
955,anger,we all are
956,anger,don't blame me for pogging to night will who shuna blane the nice belman who had a drag her luggage to ten different rooms
957,anger,it's over andyou know now it's not over until someone says i do
958,anger,o curn't kill ye but i'll have you know that once i talk in that stuff he called me fun av rachel
959,anger,not making any the ar and how
960,anger,lo ror a chat
961,anger,did you have to tell you that a the fort of the generalger si
962,anger,it'l you'd say no but her
963,anger,now you mestet up o you're stupid ah
964,anger,yet god a take  the canoe
965,anger,d
966,anger,itos do you think it's easy for me to see you with somebody else
967,anger,havin learnet that re my friends the fact ay ai i was married to one of them
968,anger,just a frrienthat's all
969,anger,excuse me i can i told you over here for just a second
970,anger,ca now that was an accident or pe
971,anger,have any other stripper momm friends of her own
972,anger,oh i'm sorry am i getting theway of all the rooms witching fun
973,anger,cant be in a raining again so i fai
974,anger,i can't you get a girl frin your own age
975,anger,you just stop talking for the second  oae wimen
976,anger,an he'll be your hear that's
977,anger,i didn't misunderstand nocasesio was all over me she touched my bisep for crying out laughid
978,anger,is the first time in my life i'm doing somethingthat i'm actually good at
979,anger,no don't thank me thank the jerk that never showed out how k i got a get to work
980,anger,i turned it off mother god i turned it o
981,anger,my apitro
982,anger,elps of rachel and i livie together probably
983,anger,ah bersee
984,anger,or callid amulence
985,anger,so an sore cal he he to
986,anger,yi serwise it was hama  mo ca i was me  mosi you muco i sister was all so crazy now i
987,anger,or no way am i shate
988,anger,what wat wat wat is it av i given out some kind of a sexiy professor vine
