,Class,Utterance
1375,sad,to neler the sthe most had see the old way of ay
1376,sad,shese honest main that you'll tell her th
1377,sad,am lack out  tra
1378,sad,sei toe is o thisneme now
1379,sad,now tad to be te oda opposite o a tos an woode
1380,sad,here was a mistake please don't take just to meaninitin  a caing desent
1381,sad,all right ii not ec
1382,sad,on and in he gette givo oc a chaint
1383,sad,neemless  dead and chil and no igger ibut those that may desist
1384,sad,lowin e deli  e
1385,sad,i was really n aurist and the accent of such a is iven
1386,sad,bbebebeammefteyr i yet
1387,sad,aoa to tose riter
1388,sad,just when on is rageona
1389,sad,let us cose ou ha  dispose o e las
1390,sad,
1391,sad,soi
1392,sad,so hat i and fride myself to sleep less nigh
1393,sad,crs christmas aper little a
1394,sad,iso aaeeioi s soii eeoi
1395,sad,ben ten the dart seng the rotan have youlall
1396,sad,ea ee e e is nae i is a table the cag
1397,sad,i on has to give up back
1398,sad,yet she loved me and tronly tress en her and in mon days an o in mi fae an gone
1399,sad,os he asking any other page cost to mis ter pln aprons
1400,sad,all thi was mors soy a yow wes ar aa a do e sow our catabals we have seen a mog call catalog cage ties and
1401,sad,o elorato
1402,sad,gaid
1403,sad,si iter
1404,sad,a ith ar a lands
1405,sad,
1406,sad,as was madelately
1407,sad,had no final wirol tis
1408,sad,an  fore a di
1409,sad,areo
1410,sad,
1411,sad,a stikesheasaeainse
1412,sad,a wotin diffent to faho
1413,sad,t i wa to go
1414,sad,arei a names
1415,sad,es y wos y women   an had my mabies and iaado babies icerage or houds
1416,sad,atatin ia torson at of hone etn behind
1417,sad,o henin on anywhere wut eud con me
1418,sad,howgar we have done underscait a very serious ilititie
1419,sad,hel they at last lei walked an names for each other
1420,sad,
1421,sad,i  a e satru
1422,sad,
1423,sad,asoo
1424,sad,t side
1425,sad,ta
1426,sad,no sannss ell
1427,sad,ai that wit the same good instair e
1428,sad,the bats of is mifonnii a
1429,sad,going yo dolng in a you o a an  ta o a i to rat  e an   cemmy
1430,sad,e emty bos is not about yere my dany pesesyou may isesalaae
1431,sad,join wytpi
1432,sad,gimy ged say my name say
1433,sad,wilge is chen our messages and judge what in o sa
1434,sad,anow mothers antmost money i fourth wedding oner
1435,sad,a skesme
1436,sad,ell obe i tor  eeebe
1437,sad,so they lay out the die the med seen the mrs an fors an the toen to be e mis curn
1438,sad,an slight change of glancs you shut down  you
1439,sad,n i asked i it he stokapatin
1440,sad,of course we are we left it of te bati
1441,sad,
1442,sad,en i toder about roger that was kinn
1443,sad,
1444,sad,the kate say te note
1445,sad,eo oi thes church an my a her ma you tthe univers tyes an a mans as a i
1446,sad,enthey had a ligge  crowny ro
1447,sad,all night ben a bar in worry
1448,sad,i ei e
1449,sad,ata
1450,sad,a os te lot
1451,sad,says the god iat ae care reae is gauter
1452,sad,by misdaining
1453,sad,its matter te eso
1454,sad,or or friday witho two digins an
1455,sad,
1456,sad,ma on it know
1457,sad,esticaiis noty heel pad a uncegot eiomot
1458,sad,they did no no
1459,sad,i know not sorry  the guise draw to the gorry goro egetes
1460,sad,what ar them  cow or so s
1461,sad,somewhat hapised an all ga
1462,sad,m a my e ets  ees of tha gir withing lie like a afsha
1463,sad,i or idmato etat tel
1464,sad,ieasoanososcandeotatomio
1465,sad,oon o pologise the ti oesen the tatetty yesterday te te shower e four mont youknow
1466,sad,look i just lost mow
1467,sad,just o not te right time
1468,sad,soout there maya be be ot in all the town a
1469,sad,egee aiito sa a e as a  warraye e dry o  te tray
1470,sad,is nighbor's ray
1471,sad,e mestul hero ti is a te cauriage
1472,sad,i hav never know won my tes
1473,sad,nsi was jecky a thea well sixi
1474,sad,at the talk in tab fi with a smile about telling myself ad kno ones even live done fom mer dess  oni aegony
1475,sad,sorry ro
1476,sad,so now i shall b for the kin
1477,sad,g
1478,sad,good can
1479,sad,scapeso ssnel o ot  he at ec he ad
1480,sad,a'm o so sorry at tat es
1481,sad,at ais sem som apin ti
1482,sad,oi o i a riht an  onin iiinns a
1483,sad,a word and grea
1484,sad,i do
1485,sad,aso imu
1486,sad,iin oder maybe seem tims  a malaime ma a on teveg
1487,sad,sa
1488,sad,at that moment ut by the mintalsow leathery wriggle sir jos
1489,sad,asaisao i thot lot ot ad ai i san no btli o lo ais not say o
1490,sad,en oe tal woe  a
1491,sad,usi's like  e like a drong strong jaw
1492,sad,tstoll a t that i love
1493,sad,
1494,sad,i am sorry about what i said
1495,sad,such soat bessports great spar across the carte soan nucked  memal ei nod ly a
1496,sad,ho te tet e that min that tat redisa ca
1497,sad,coss toy joy possible
1498,sad,an the rutously an sat
1499,sad,
1500,sad,
1501,sad,ied  sorry te did go the space pa but te ben  may mad somehow thi may held my gobsoeo i presentay sera jonelis tie ta toouce by suh myis ca
1502,sad,harry ro a a ai
1503,sad,no i want to tell you yesterday but i dissus mi yelt on  loin
1504,sad,father ol judyi scared an tad as quite has own
1505,sad,o soso so shmo i a ani in an an wana wet away thet time
1506,sad,nat ic like thy e a stupet
1507,sad,y i can as es meai hard it's of fer
1508,sad,an sorry
1509,sad,
1510,sad,sut i worken in i
1511,sad,wet i mats on tee er
1512,sad,y iav just so excite a see ou arpe  e
1513,sad,oguran toti coter princes coter
1514,sad,an  sur now i beg a i ti ar yo ie you farter so a s
1515,sad,e on sci my lat hha  bera te saida maybe pater with docto basada thaeee
1516,sad,oangramaditea
1517,sad,i know whyt you cannot use that to in e you by inthelen we an i us a eo  side
1518,sad,eg misia rond
1519,sad,so wel hant yhou do
1520,sad,i shetof litin ma msheis wanted tell ing where my father  is she no
1521,sad,wenti asi witer
1522,sad,an jaliso gane e a bot  serger and li to take the doctor was to bide anjust ir fell an son
1523,sad,this is the hardest letter at ever had arrived
1524,sad,eaeeti
1525,sad,s ai
1526,sad,my neman si ibad abandiner
1527,sad,sorry for gad story or child i thinks i
1528,sad,meani had say e a
1529,sad,d of course it is
1530,sad,wors
1531,sad,sory anis ereaty tell  to have to stock catchr and fire
1532,sad,still hell if the world is weady an three
1533,sad,i am sorry that hat migt happy plan
1534,sad,to watterd aler an hour electrician tin foger o what it ay
1535,sad,tepere
1536,sad,sariskirkin e
1537,sad,
1538,sad,so sorry
1539,sad,
1540,sad,my leds o woy
1541,sad,is a mas
1542,sad,
1543,sad,sar yr da
1544,sad,etelles me wi et we mi
1545,sad,thing to stop argiet a sireturgatgo isa
1546,sad,is fat but to sa
1547,sad,
1548,sad,ste wod man
1549,sad,i the no by day a
1550,sad,while i wuld in a chair
1551,sad,emay maa the shedo over herea  o
1552,sad,ma pass
1553,sad,but i have to tell him how i fe
1554,sad,men i you neva nneneren ut a heads on  bar news o  no think i a init is alsoo
1555,sad,
1556,sad,i gilyjo clon igain ell er over the gat
1557,sad,i nin
1558,sad,i know begas to be gran mother yo hav te they muried in ham anchilder ta nigt o a ti a lov  i o o mayy
1559,sad,lovat you makei o tracko
1560,sad,
1561,sad,a i emade them like ae
1562,sad,ctss
1563,sad,iste tat o e sinur i lost my heln and shir
1564,sad,
1565,sad,ii sorry
1566,sad,anif im i only attracte e eyes where thereis notin
1567,sad,sods that sies
1568,sad,well ce antid selte tates tor e sasin eestis pac cir get isi wel sis
1569,sad,i see wods tate ensiit
1570,sad,grats wayitoo siica
1571,sad,you a wy to lijus go the next moring friend you know and yont do jo e favor
1572,sad,ye he applat wen a youn
1573,sad,hr eryyear y omas
1574,sad,in sat the se fy it the left te way whil
1575,sad,pi ship book of back is p
1576,sad,i esen i saw op of walk
1577,sad,of the midi la
1578,sad,i a hike a hi
1579,sad,i sa sorry fo ot ot o sa o a birstin in
1580,sad,
1581,sad,i am s so so anso so
1582,sad,i
1583,sad,e a itestito
1584,sad,i
1585,sad,nex more than peop i a iea  s ta my i  e eotiin
1586,sad,ot n special there knoi a es
1587,sad,he guess i oways asly
1588,sad,i tesi a maa tad her
1589,sad,li
1590,sad,on eream to at a men cair that you meet t onter eer
1591,sad,loge  why er or freekish quits sesaa ther to
1592,sad,ever lo
1593,sad,it ne send the man ofour si
1594,sad,with e y clots said a a tis
1595,sad,o know wha  a a bable to joy this
1596,sad,was so wi oy ni se a i
1597,sad,did you now
1598,sad,o widy wan o cul youso
1599,sad,nooo to me aconit oa swag to play coon i do dro wa e wertoles her
1600,sad,musician rtsand restaurant spote it joy
1601,sad,o er o to god to to god wo to god to a
1602,sad,and the wor no no wat its don
1603,sad,and ai am sorry
1604,sad,io day will apparently
1605,sad,se ballsn tele
1606,sad,not o monei a iansorryias sienc hichso bonny because that was leven my major
1607,sad,bao ofte shi lots tesayo of  he de bury an of thf sousbee
1608,sad,
1609,sad,
1610,sad,sorry
1611,sad,there was a skid and my class who said hes a love of me
1612,sad,his at felslide too
1613,sad,es tat sin a you will finiiing mabe tewe
1614,sad,st out it's my frien
1615,sad,wod is a sweet he i con strait
1616,sad,
1617,sad,after i is my fit
1618,sad,isaiel aa
1619,sad,stapping you suppa
1620,sad,the  e
1621,sad,
1622,sad,his wife th bgese big ano owi eaa oa a a an
1623,sad,
1624,sad,slo soi be socrasia i  so selli
1625,sad,no sos god god we ar so sorry
1626,sad,i en i was in to me holless
1627,sad,seisteteei
1628,sad,i stud his soo
1629,sad,a doa pe
1630,sad,or so you metinate that re moredi e li cav
1631,sad,i now i
1632,sad,re
1633,sad,shaeavy ro e  manis
1634,sad,sitnire trying again  and we had trouble au time in his apparently
1635,sad,yes yes perdly or jo tant e ta e gi sen in e voge
1636,sad,somyer o were that i i  i lat special
1637,sad,
1638,sad,on my noterton mistaken autors
1639,sad,light congradulations of his big gray
1640,sad,t
1641,sad,i really think this good i deits is tinty a min
1642,sad,wa hi ice pesteinte jeble  day
1643,sad,al i say not far wo aan  e wa den do the stao
1644,sad,
1645,sad,o losing i rashly and the tew parties
1646,sad,ah yes er about that
1647,sad,od o tak on tenturi  nohavi
1648,sad,they were rested mon
1649,sad,ow could it not be we pretty siler ande hadn chance ane a tan er just tat a way hanging and with ther coublers o ad ha
1650,sad,wha one wer he o e r  atstesh
1651,sad,it helps to me look to tin off be friends me as happy and i am te en e ant
1652,sad,my chound at naw it istill yo  odew me out
1653,sad,they ow t do
1654,sad,
1655,sad,it's at the first time of us to girl the cap wis spring  be jap to men
1656,sad,so forcin here to merry bobby is going to make that hapit
1657,sad,now emomestermen aeead wy
1658,sad,eers veiin like an adlon
1659,sad,ins pera o e
1660,sad,
1661,sad,much is my tire family was brawn out of sconglet by  ging hing woe
1662,sad,
1663,sad,a lala lay  cu
1664,sad,o no manan yel an gallin an n tin abloi sing ber norn a gress
1665,sad,nel
1666,sad,
1667,sad,sore
1668,sad,sorr
1669,sad,hhe go on mithousand o jer
1670,sad,
1671,sad,i anser i juseeitese
1672,sad,siriday
1673,sad,no his ar is rega his sad
1674,sad,we sola becaus y a burying this womin
1675,sad,slums ain white chain
1676,sad,
1677,sad,ju
1678,sad,saster sosing al the arn
1679,sad,ettis teithey areeal i i
1680,sad,a by myself a handly  everybody heeds me
1681,sad,tie ittisii
1682,sad,is impore dised that it it ivif five years and nsor
1683,sad,looked a
1684,sad,the serpsid i had the workd on naw a
1685,sad,i after temes
1686,sad,well  wer i i ce the lost e
1687,sad,ais oh corgiai say  matis stut  ma be is a beatito
1688,sad,a i i a eter a
1689,sad,si ao
1690,sad,mons men phebe it's ansually my best mon w
1691,sad,there's no moneythis tarths ti e marri emne
1692,sad,varit
1693,sad,e could no wite is huguis before her heked
1694,sad,wol since i was kind to my fati gis ol she had to stay
1695,sad,but just woot o tet what does the me do she has rasb
1696,sad,e ie e e woeis twy  de  you so cold sa
1697,sad,to unjige only ehe the twiter
1698,sad,his enery to day i'm sorri
1699,sad,
1700,sad,eoosugouseto eos oeeoe
1701,sad,irally wish they care jus alite
1702,sad,asi in so i te a o a te  t an
1703,sad,li de ie made this marriage word i avd
1704,sad,itsponny thing we'll have any
1705,sad,what chance yourself say es
1706,sad,oy oto i ai wis yo  dat
1707,sad,anyway i just som o  thinks on eecessar urde
1708,sad,os  knowwing i m so sorry
1709,sad,wat
1710,sad,t thanks to the itleturkey asily  fortajuly wen lo appe john
1711,sad,
1712,sad,say
1713,sad,shes e od
1714,sad,so ay way way to a sorry you can't stay the rest of us have a lot a more to der
1715,sad,ias to think of you we sympathy that would not avei everer heard me
1716,sad,sad i down je's bost it for ye
1717,sad,wus she i she would' do that she's wershou me
1718,sad,te cecesesone etepegnenat sad
1719,sad,those an  mister some guy  reosheai
1720,sad,i am sorry
1721,sad,settjust
1722,sad,o so sorry d saileti ma to bring yogu down
1723,sad,what is the big dal attell like words os oo
1724,sad,that ii yes e sas a damage goos
1725,sad,e
1726,sad,the do trarts istak
1727,sad,itisaiolin mari
1728,sad,god was and te medo
1729,sad,pargan tis tetes for t long reasons on now
1730,sad,nn hedon deserv tha a don ros  lily
1731,sad,nl see ote t ded stapping on he sen tad
1732,sad,igan dothis
1733,sad,do likes men an said ge too
1734,sad,so gad
1735,sad,t
1736,sad,and iam very sorry but i really kdon't know where your father is r n never true
1737,sad,
1738,sad,the tae
1739,sad,o wel e went t that i ti is i tadout then think wy a such prisin tay in such a de meeting jodg
1740,sad,oon which sti plain
1741,sad,i dare say hew ta yo want just ant to su air
1742,sad,it seventy four tetors adgelatui finigt
1743,sad,im ashamd to say i ook iadvised a fellow actpra bo
1744,sad,than tomaner mor he dan their dad
1745,sad,hhand does not hapen a store s
1746,sad,i just sa didddiddnit in a sum way ir girran get his arm around o
1747,sad,gal liis w
1748,sad,ee a now
1749,sad,hesnot even even lay to
1750,sad,ee e o  e te e es pirs tar e
1751,sad,i i so sorry i i  is i straigtest out  er tomorrow in hers  to orra e
1752,sad,furry
1753,sad,i  i i i ti eiiea ei
1754,sad,yet i hee well oni aa is the  saidy tin so inowtis o los
1755,sad,ar
1756,sad,etisaei
1757,sad,and i love you and i wantes to be te rands an a ykeepliving here i don't see tat have now
1758,sad,es ye nather graybother
1759,sad,
1760,sad,ster havpans
1761,sad,e w te
1762,sad,n just do e to give back your worse
1763,sad,shot is a boy by ba  is elin nanstiltat a the appbly was pco ta the valato to i machly thries
1764,sad,
1765,sad,
1766,sad,look at her has even hat witressesspirit  of him
1767,sad,o
1768,sad,chapsi te ar
1769,sad,so guilty of for
1770,sad,irs a wet  the ti wa can i wat for mrs to break out break out
1771,sad,i lits my mind to say sa
1772,sad,a  after tron  es ell a
1773,sad,ha terrib  so
1774,sad,
1775,sad,but i bought and i'm sorry i tried to stop him but theyd let me an jail
1776,sad,
1777,sad,here now that's where we know what does matter a e e toer in e rim
1778,sad,and shou won't tell me
1779,sad,at yor whit ed a while with t was  the real ran a
1780,sad,hens on the ciler
1781,sad,es hoppya all time si
1782,sad,e
1783,sad,tto the matter al the matter the  you look so is
1784,sad,iweraititeis
1785,sad,ke we is to stup sa
1786,sad,wat  i o a  i  te o e e  it was soar its o lihe e
1787,sad,bt ty lids my lond ow is finished wi towarded aft
1788,sad,sorry eseses ie ors eaieac cee sa io
1789,sad,nell cid all thatis retridiculous
1790,sad,
