,Class,Utterance
0,anger,e can owly sal ma
1,anger,or he is otethe shall an tomea
2,anger,i think she's trying to make something  a tan we know to get back at me
3,anger,onehewe terwit a it a i we
4,anger,n wokbays d with every body and strak serty they now
5,anger,itea
6,anger,could have been killed like he now
7,anger,o whot can me me
8,anger,eso ol i i
9,anger,li do den
10,anger,ah admitted tat's ta bast na you over had
11,anger,he so he
12,anger,not a copeesn ord  wut yo
13,anger,ont lie sitting up here i jemot
14,anger,still very sagina
15,anger,
16,anger,siking frathemselves of such aor that of mans alow
17,anger,nobody sees the care
18,anger,
19,anger,marygener
20,anger,e   doe iesosly to night for conin  a  ii   an telle that i e be  that ar o an i fo that should be ther te
21,anger,say town an expectinoste
22,anger,e
23,anger,now  i i tokin you you a bat to ting nyou at away best no
24,anger,givin in ti enes
25,anger,e mie ston  ite  poo o the former mary wen you
26,anger,
27,anger,e fattime
28,anger,sert
29,anger,
30,anger,i nanything ever moting ouse
31,anger,e  e ee
32,anger,iasa mad
33,anger,i pemetically
34,anger,ge
35,anger,gin
36,anger,aita
37,anger,o so hard we har to throw a jud to where again
38,anger,
39,anger,exo
40,anger,thats i
41,anger,now you are telling me
42,anger,now the wa i jacker i du
43,anger,er teeoeean ears se
44,anger,did you not har me saying tooven
45,anger,noting i admitted
46,anger,a so fri i o  o the ee o ma
47,anger,llas as ijacus
48,anger,a an    at it all o joy
49,anger,ignactly i in the path
50,anger,wings of in
51,anger,o sto man embut i al so nowo ie the grin aw e is tonis  on te  hemselves osel i sporning ther mi twin e tet ma but i not ha ma a now ends
52,anger,
53,anger,
54,anger,what did she say
55,anger,many a customery y progestion in suggestion one
56,anger,ke a catket a gogirkle snop g
57,anger,so men a pacriat
58,anger,coming
59,anger,to tell me something i don't know
60,anger,is ot hand and he  a ba wit
61,anger,
62,anger,it's o funny
63,anger,i it wasn't right and i nont an thing cit ave to you so o tby you something that i think to wenlya toi
64,anger,wa i e dow her
65,anger,esmaander
66,anger,joma sprent or time on i sad erii an tomn
67,anger,
68,anger,ther a trading we dont se y my prayer
69,anger,etan state of cae ike ori
70,anger,wasn't her out it because i care about got i
71,anger,a i ta mads a panding my life with an
72,anger,waco la
73,anger,stop making canki
74,anger,nothin i their nargefally deadbins o still
75,anger,iapible day
76,anger,you go back ou day can owe dead lon
77,anger,o made never bunney look over their dil iteag
78,anger,iiaa stypinea
79,anger,by to allboe
80,anger,to is now
81,anger,mai ty my caro
82,anger,
83,anger,o ofle ita hely vey
84,anger,i have been o down in at sor an twenty liget trying to get as high
85,anger,to pianex and areuni lay e miles and arond im
86,anger,wont you is as good monney that disijanes efaur an o ile glid seci or by machine
87,anger,o cay i catt just me away ond kill time till yan make some one better
88,anger,steating e
89,anger,work lil so
90,anger,he fought i botou together that he ran off to got married ancs got ready ugly
91,anger,der   o just sayin o  thepor  e al da when way i wit a
92,anger,not o
93,anger,to him i cia believe i took her off my wist
94,anger,o i omaye e e eot e me  wor e jane ar mi
95,anger,the sermiis e hemrlegeo of relationn
96,anger,eon olyly person with the aliatre chage and n te sanctaday an te rigeer the lungle of ther the fane li sondi
97,anger,os i am talin uis usin you to get mackin
98,anger,i ato yet
99,anger,because i show sal can figure now
100,anger,cus tortair
101,anger,het on
102,anger,seyo ia bardy not set is light efore
103,anger,tha joyous constant notof cracting isn't an aay
104,anger,ollior ol tewy luxury to the verry hert an is aaof worlds
105,anger,o tri by my houns or i
106,anger,now
107,anger,only n igtente were to stumpe in mat the caw
108,anger,ootieie
109,anger,wat all the way
110,anger,i know ioar le le don let ton lets to ole
111,anger,a grazy sthing is i just say toa way make to myself
112,anger,i giv iv one chance change we mon your one an
113,anger,
114,anger,te cals an wasbethink is a hose a ic en e  o be
115,anger,
116,anger,i sa
117,anger,why don't you tell me os pust een or not
118,anger,your raise a ra mam
119,anger,i better wild not say you shouldn
120,anger,
121,anger,i do enjoy  y je wa i mean
122,anger,igen te age  wi
123,anger,happy itat att be be  happy
124,anger,
125,anger,seti to my
126,anger,evehatie or wor oter wite
127,anger,her with so soer wheled hre
128,anger,aha that's not   let you now
129,anger,ere and itself reading it to decorour s inof e n  e wild  i fi ee
130,anger,frandto the horn out
131,anger,notbo
132,anger,hat tot i
133,anger,racde
134,anger,ju neja agansi
135,anger,tof  bo
136,anger,
137,anger,didejust lit
138,anger,has call on at not been anything atim
139,anger,deode
140,anger,i jaou o  mo er
141,anger,tou
142,anger,
143,anger,ooy and lotc down bie to go
144,anger,
145,anger,tom may te
146,anger,
147,anger,i coun claiy the old nod
148,anger,we had told at the bowd whitch
149,anger,
150,anger,
151,anger,as or something bon t minly anmariable about me
152,anger,a pay howbout the smoti bog it sats all to spat  yo know ow i oto no mi mi car till i feled either ayi sasin sper er the gir bi
153,anger,s me lace than i hhad just plarning down for fine
154,anger,oa  n o on a o  onstri n  r
155,anger,eso
156,anger,
157,anger,you wile not suppose to ive bebl te bys
158,anger,
159,anger,
160,anger,stop toi t i stoping
161,anger,
162,anger,
163,anger,nos es
164,anger,foter te ama
165,anger,hesvery
166,anger,sin  he saying is now wor net
167,anger,there as witching at the next rest i mat you ca gy to dri the whole way bown ta to ter tn a maydream sleepar
168,anger,o  nulr day
169,anger,sleep last night
170,anger,ere e was heword
171,anger,esorsoasi es o let ofteei
172,anger,di
173,anger,an ye get o a or  ti an fild by
174,anger,eatewiis te wls as e
175,anger,mais
176,anger,ki on way a  ay il roun
177,anger,e ril or
178,anger,ttit tit sobut a litle ladedheer but ter you so tat m t
179,anger,
180,anger,i'm sorry you ta o down besped o  asa es my real fis mi dow  oas o i i do o sa a
181,anger,sonding in in te gur
182,anger,saly an mi on
183,anger,i tageous modis really cocking
184,anger,o asker hos a now now this
185,anger,esssso
186,anger,of factiol
187,anger,down an then you remembere going into my curse and stealing the fa
188,anger,f the pi
189,anger,missis i alo i wane i o whih o be tacking her
190,anger,in tepanful pliers of praws that is patumully procestis
191,anger,in a cap
192,anger,an ideas in his ad i am meseer
193,anger,el
194,anger,ea  tato no i ha jokes te e stupieeanig so
195,anger,capliisai a
196,anger,the draver hand to tell you something  never don is rather tired
197,anger,d no just ha
198,anger,e d
199,anger,i tad and i justpa tur a month ago and  e on ho lat scarce
200,anger,i had the money to take ou a fancy price like tha
201,anger,
202,anger,no on no first nam
203,anger,teeeosoeoe
204,anger,i  care enough to make e tat lote craut o e
205,anger,but no on to fal man wit is friend at te ars at all  oi oin o dow
206,anger,in de linary taste i o cary
207,anger,to thet y nearest tothe wad
208,anger,nor a log to at te lony
209,anger,ifthe ocesters tinytiy la way  a  as a ta e  toa y   e a a o as awis aye a
210,anger,
211,anger,you're telling me there's nothing know i known between you two
212,anger,ii lent to be with fairer i like
213,anger,but by the time i got to a cully coup of piece one
214,anger,oi the holi mastr e tried o mic suc a porka ya
215,anger,or mane te wiers and un unhappy
216,anger,
217,anger,
218,anger,
219,anger,o we mi gettos meadin arms of mi an ot
220,anger,as not i batter a saw catin a it was like torc
221,anger,
222,anger,mama day or so in te how
223,anger,
224,anger,a dozen mi
225,anger,mino o me me
226,anger,i ia sokr fort an o i i a n e ni  s i ti an soi ar riges
227,anger,you think i should be look to bay
228,anger,netlyinatite
229,anger,
230,anger,telong hehind to dal was by the car
231,anger,wi e great graveness a
232,anger,ar y   war
233,anger,thy declined as
234,anger,i ata hi e an i an i notly an taras any more
235,anger,miste lost his mine
236,anger,no ma  i i should take i way
237,anger,
238,anger,mi was the toils of seventeen times a
239,anger,woman i thinkit o feminisis sul guide gude
240,anger,tell me the train
241,anger,who set it down on ter there and thekid  make such
242,anger,jus fell as persion  o e ain foud o  o til a torryin i  ow tell wi an a  e
243,anger,ninalways hav to bring him here wi
244,anger,snows ike thike e te ted o orsoind   oays oldebl
245,anger,aas a at
246,anger,
247,anger,make a man iga by the boy
248,anger,
249,anger,thas  mae  tose e rea e like ta te pall of his sister of the latter
250,anger,o o wit oi li it is towin t
251,anger,antiw him eeboke to guay barely now upon tot es
252,anger,e in a did tis ra ready
253,anger,apathetically why when i be married we afort
254,anger,god
255,anger,oa a ar
256,anger,pashe chaps  orin
257,anger,
258,anger,a a ruged head
259,anger,behind a man
260,anger,oi i i ithot
261,anger,o forget we  are just u
262,anger,ot not gana thi ety
263,anger,por heren why that i  taything  who bears me that for hey
264,anger,oin yewell in someplas els e to te rest o my toin oi  bgelin
265,anger,so that so ets can be not o i tould break the wos to
266,anger,te snil re ba is
267,anger,the e on jail little jail between the doors
268,anger,say it at about time meant sloaking an hart o riginally
269,anger,nine to my reso
270,anger,way
271,anger,mi now wony she can doro never of or much gos y y sool
272,anger,aee
273,anger,just d do thinshe di
274,anger,hed'll tell them tha i know m
275,anger,
276,anger,no sons no sa noga
277,anger,i h tied of  tins in your he's only hee for sfor hours and aut tenegas
278,anger,i o just thike a tit you gid evar fo guisan i ta la  te dead cipolus and star
279,anger,did it it at agoge
280,anger,a talk you and nothing
281,anger,respectfly disagree
282,anger,a i ana
283,anger,y the yepsof rogerttonsan graly looking toward to tis
284,anger,imi ely voc is well
285,anger,
286,anger,sowing wanwii er jowing knowing at my men
287,anger,is it the cause that to qols barbar
288,anger,no he was alon
289,anger,carrarrin and ta girl over the
290,anger,a sershes us clora said the she was gii bin worri oay
291,anger,
292,anger,the conta copy wuld sente than than a gron
293,anger,no no nonoo  e e to  in otin ot msateo oty reches eis jusmen o
294,anger,heer her my bits mirl
295,anger,ok your coure evil yo hordylord don ix
296,anger,at  wake to o o
297,anger,
298,anger,the morning at a misson i can tel tem
299,anger,bar
300,anger,e was keeping my sister n a dngen
301,anger,el why gad said the trag to time with
302,anger,las ti ta wis a dear e e an his lying round and  lat aa a ing
303,anger,o ater
304,anger,ger i said re so sa e  te e maniy a is
305,anger,oeevy trinking alon to
306,anger,ter n
307,anger,sup of the quality that
308,anger,nsoy the chato mag eally worried ba his wor
309,anger,may ar next eyooto sa te ta the day ris or aanst mely
310,anger,startin  dian
311,anger,you hiss hen one more than
312,anger,
313,anger,my mi dogs wat in the barner
314,anger,a piano wee tha clothe didt he by
315,anger,sedey that an n ons mellwho uniy to take a by
316,anger,is is like swimming a yew eat finga trou
317,anger,now he mades to tale about his olal tingting taonoin in a g tin en eti beriand  te borininis ons
318,anger,
319,anger,they waye sank aloud
320,anger,t is the greate thin the word always jstchil
321,anger,la wha te tan cal nean e fo taa
322,anger,ats taki wos in down aw of pape placees bo an r
323,anger,only es islik i hors lioeer
324,anger,hover you cr
325,anger,so en nat at the king of the wrigto ditch mad
326,anger,it's just a how the expression of female sax won min which by the way something the new will never understand wenm
327,anger,o new it's not wot of a kind a tray
328,anger,aar a borl as at te tabe   te sho  table ver wi table a tables a show by ball
329,anger,not so bad what hea
330,anger,
331,anger,an manhy to do er energy mask an eer ama de
332,anger,as i sli then
333,anger,ei nowsi me wit a beab
334,anger,he  a a heel
335,anger,iais myneasoe tisis e
336,anger,you i throw myself that you and you say now der you
337,anger,nagis
338,anger,i now
339,anger,al i how she liked him
340,anger,notre is noi l  olokin l
341,anger,milol faces love a to gree more
342,anger,
343,anger,ithing so small a catteod any fa
344,anger,on ason  because i whilns bfor the actual day so tic
345,anger,
346,anger,i
347,anger,i call my an jan and they yelled to me if this is an unmejesty that want is
348,anger,no one cross wel like e lid to get away with
349,anger,at sendin no one hons titing over there and runting them writ and
350,anger,ho i ak to say mery do you talk to my mas beni tat yo stooping manstin
351,anger,o no keep twyng i t i a get ot joy i
352,anger,cis e totits elie havies to beor an aneelaid eeteto want to be played
353,anger,u tacho my wife and make e tie
354,anger,or tact x wife
355,anger,here h needle wage
356,anger,onoy did not drinks near the batte
357,anger,tthat you did not not mid gote i e not ban i goiyou
358,anger,ias the mi b be te
359,anger,mioieoieitie
360,anger,yso an wotointor an n i
361,anger,o yer sam with ranny word if i never thought of tout lit or
362,anger,will you wron i'll cary you wron
363,anger,iterestin a ther amstics a shot many and me against the world   thisic hav stok great ays way
364,anger,my careand spend the money for er wed
365,anger,kitting t heard he mee
366,anger,je
367,anger,wore you las a dar cotes
368,anger,sys  ni to stay up almight for  or he e saony so hire
369,anger,iijecon out an believab
370,anger,
371,anger,os i wa ejestcatist himself non a pas he of head
372,anger,s now mis play of
373,anger,
374,anger,
375,anger,ba gettinin his chains to puwter somdefie poa
376,anger,mine
377,anger,he gensgir thingsgiving to woll get ol a sat much of the mody o held
378,anger,do
379,anger,but you never have the chile   ill i e av gol fii
380,anger,secret getet  hat secret  we mon in oter wit much wone e waspect on tatea ehar
381,anger,an a
382,anger,the lot wo at pay nay
383,anger,
384,anger,a parely lucker  at im
385,anger,anse newaan an ega e
386,anger,iyi adinin
387,anger,welsir i ighty  nigt migt wor is in min
388,anger,th
389,anger,ike he li i busness lil  aa
390,anger,it's much funny this is exulay my to
391,anger,a io testasteroli
392,anger,et let to get that i believe nott be su furtois
393,anger,egeibilli  bo
394,anger,an iw let do atin mister jann
395,anger,aerwo
396,anger,an made us made us on a say which e is we o hi
397,anger,joe baless an less than a gy
398,anger,
399,anger,ilmi me omiin night
400,anger,and an were e wat disi wi in enman stel of stay y siisime biting anty now
401,anger,o be waited unti my  ain e edso that i san ees he would know that i had nothing better knew hand waiy around irin intacho hi stupent han
402,anger,s alexample racial
403,anger,
404,anger,at propits that hecaye so en count
405,anger,e a that oa
406,anger,i may play te po the times and vines a little more the distory blond girl with an ansabo wes an
407,anger,war you matter he said i wash a goary cow
408,anger,joi  quick e it of the discase to comp ther
409,anger,o poni i geer like in vain
410,anger,i
411,anger,so evenever
412,anger,if you are not yo to mry er wy as b a so o just ik to day bat a
413,anger,y richer
414,anger,at feeds
415,anger,osterealisisis the mirs  tim my life i  a of thin a ta tar maitthis is the first timet my life a jois ofthing at avactually dott
416,anger,i
417,anger,i mo by desolbo sadi er not a raal doctor ay its bo
418,anger,yo hi o eisly goudless an there's a chanceo i vouryvoury hard to
419,anger,lika sece s
420,anger,ot let e stoll wore then ooi gaeterew fifteens
421,anger,o a you happy fy fy father than you sar
422,anger,tly ot the surancs with a hair od dlyn
423,anger,give me somch pocipics
424,anger,o shariaas i always ha to day i
425,anger,
426,anger,
427,anger,what o you thinki i strong in here make a bess a ba band o comrols an we till we cleaded up mile
428,anger,amemit o anowing as th
429,anger,majors tell me how muts eas of mel  itemacause as
430,anger,not the lat i a
431,anger,she drets on my nave sak cant hardmy
432,anger,as should goin to wing i now in sorry whet in of this ring is better not ta everven saw tether
433,anger,eso
434,anger,s mad fact is a trustin e my best friend i wanden in e wollows of te e bosho
435,anger,wat's a baskwat he's wite for me to ask
436,anger,
437,anger,i ye  e like  fel
438,anger,old touch gay by
439,anger,eareoi aso
440,anger,io o lar to ton't say l sy ha to play with you that
441,anger,use to work with her use to ie ra wi a in an minin
442,anger,its till la
443,anger,nstap using my name
444,anger,now sailay  again
445,anger,now ho o ho  ie lik a like he i tes as as wegeous in my
446,anger,a chantler you cant you your hands oer  one fack at
447,anger,te
448,anger,
449,anger,i bo ti ou
450,anger,gennls teosa
451,anger,i can' tak
452,anger,
453,anger,but i told you i didn't an id
454,anger,ins a newspaper ars  acraa
455,anger,isa thee the damage do
456,anger,iis just no
457,anger,jus do dow an caano an an o tolas the lass by
458,anger,s
459,anger,people they be going out for te wings tiis an ii n jo say no
460,anger,all ght riht if you insist endayi isan m an o yo
461,anger,at lay our weading
462,anger,don't you talk to mind mi man y many stupent bansting
463,anger,i do know exact
464,anger,whispersen words again
465,anger,etis out
466,anger,i die ci
467,anger,othe tie
468,anger,well sus me we switch to par mets you can't eat our  n more than that mae drain is in
469,anger,ine stod yield le le or beside a gag beor lom aa
470,anger,bat  was doing my man  an witwas oin  orintmas gan
471,anger,i aryou es se pets playing the street wer er deand there give plodje wher there they
472,anger,
473,anger,iits so dip a go i all ays the lands muth now everyday
474,anger,sav rest fore corse
475,anger,had no wit coming own to my office or us
476,anger,i wy to
477,anger,was matir i scered
478,anger,
479,anger,sasode sad
480,anger,sa dea wo her fer siter
481,anger,hement have done a
482,anger,ye telefe te
483,anger,wo stop by every y stead and bord every copy that sretanise
484,anger,just wat like you knowa change my mind eny do itw anit os jelly
485,anger,you know wyfen a grow fenter in a ton e ot e mestin is for life
486,anger,wo o
487,anger,i i toi the same bed
488,anger,
489,anger,
490,anger,n
491,anger,why is i here  loutin lad
492,anger,but a nice gy up its la weds ad how dont he jos ary
493,anger,i accept all those was white icig an pipertes
494,anger,the waiter carring the bread sticks in his hands
495,anger,scape mates no sense
496,anger,os adithoo wy el  tur ou
497,anger,
498,anger,a esat o n te die be far away in ou sea
499,anger,gay ligt a
500,anger,isesin aber you like tha isus an soven be
501,anger,oogan tanti meer with nam nor ma sai
502,anger,efore you know she's wit a
503,anger,e e to sa here silently by a dman neer os
504,anger,gat ae let god is no righto
505,anger,oou tieeeeepeople eawepeole
506,anger,yor bigs lo
507,anger,no no ter that
508,anger,ses me man spkret alles gree
509,anger,wot mop out of a gain
510,anger,
511,anger,i ger very god sider
512,anger,
513,anger,so i cat king  a ma here to say to that say kiyng common wonon a matures wo spir carcular from on ale care boe bodies stuck in poor  an so lon
514,anger,y ont you think ot somewhat else in red cha
515,anger,i ims as fun to make a good firstin pruss o
516,anger,mao youcdans wof my porish in such are mal
517,anger,tayn take any word jus
518,anger,is
519,anger,e monarch is made of honor e doiinmy orsoes ea e tear
520,anger,teenoositosoo the es nowsdoes the otets s for
521,anger,nowotous ayo wainte
522,anger,o that such astcus is my cmer i have cin e
523,anger,ewor e popl to temself i sorry that i nit haded on my
524,anger,i e plan   lan get up my man
525,anger,e a litiwhich brinsits by decords toeli stery doc
526,anger,s i mar marriage isis the worge wors aovorii o iii o ma my i
527,anger,de
528,anger,ma
529,anger,you a be storing as mana
530,anger,that's i t on get offa
531,anger,go the means to  othe
532,anger,eevery one only
533,anger,we wort weri tanwe were wen ar manyins
534,anger,i am not getting in a cop i you just haved let you
535,anger,tesi i as i
536,anger,gats for e woth wot qite sail
537,anger,ecouch far along in trageto
538,anger,let's go mak money
539,anger,or y ali inoi ma to my yjin by setsshe nowsjoyy
540,anger,deee
541,anger,yo eate into the lansmitn so i sang her
542,anger,may be to bout a mile a my day
543,anger,anegan it ta why
544,anger,i do i get the birds get the bird
545,anger,tatit he wul big ma ea a jo joajemse a
546,anger,i highly down dan er r
547,anger,bysad insho
548,anger,ou iwe weas is that all
549,anger,be
550,anger,but ad thrown it away abuil ti o
551,anger,
552,anger,ae
553,anger,he tolli why yo ar n yo saidi weat wice
554,anger,why nt you  tell me where is was to be
555,anger,sterios clowns can be open
556,anger,this body of in
557,anger,eredoein eleve
558,anger,
559,anger,i e taaa a i ti a a  e plit o a lay such a  mastre  a
560,anger,ni you made some sort of afor reajo
561,anger,i no ti wit finishtisperin hol y wy if oit i some dayif inytin
562,anger,swither is your father i shoun ma a co my you
563,anger,and nythin a s a e ot an i eni  tan  s e shuld be ani marrie e sol  e
564,anger,ansyer a way i sidastthat bidi is rings restrid
565,anger,sy everybody else sad missus do
566,anger,may
567,anger,e start by bars
568,anger,this year was suppose wi great
569,anger,
570,anger,and the loveliereman the givema ter o  a y i  li
571,anger,as no great joy
572,anger,you apologize teze  right now wy a tolit maa
573,anger,
574,anger,tae
575,anger,res nams the magain
576,anger,o il excuse me for wanted a girl friend on our iniversary boy wouldn't as i meyes
577,anger,a disturbing hiol bok beis
578,anger,and the othe anteti by th  not foria stickat racep
579,anger,
580,anger,eio e eteoteo
581,anger,aty is at prinspos to be tint
582,anger,set scals  hulld on a secothis is my fine sesa
583,anger,expecially i cofast igtryn  last night judging by the soy de li
584,anger,merin my smol  made ot a an sperrol even though i knew th one
585,anger,so  like ans are as sat as again as you wald
586,anger,o he sighed but easy suck an mad tan tar
587,anger,looked atas agen
588,anger,no te ay a merry
589,anger,trising death
590,anger,ss oyou like ba cady bon
591,anger,e selescrige
592,anger,e
593,anger,you'll be or otor were
594,anger,nything you
595,anger,do be
596,anger,don er som mad i have
597,anger,a per
598,anger,ai anas atigetting at the moud
599,anger,why  selliby your relation ten to s e little armen menten to declare your love or one other to the world
600,anger,y always wondering this impossible to incet security if any intelligence uch
601,anger,an a song
602,anger,us is excit teci ti te ext of the e be tes one ma oe hellow wor
603,anger,its is my fole o e e e
604,anger,vree
605,anger,answer which you get wt hagh o e
606,anger,called the babstain chain com in o hg  hig ig tapthing with a very moll respect
607,anger,siursusa e i rary ni e woman tin drow man e laan
608,anger,
609,anger,irar ar i ia y wa gap a
610,anger,arm
611,anger,ine litoretoi
612,anger,i don't care the wires of on lusin heread
613,anger,now you guise i not gettinii  hai hing i tng on som else
614,anger,o k yxpeck i thought of that
615,anger,is is at fonny
616,anger,gaiio sal
617,anger,no nowig inin bedis teaping under non of door
618,anger,
619,anger,a yu  y  now i a
620,anger,a tat the pats ol
621,anger,as bo
622,anger,no ju justi cup o more boxes
623,anger,i gat i tuge you tagain anier
624,anger,o jay  a
625,anger,wallety a neri
626,anger,wors a wors
627,anger,beo
628,anger,emir
629,anger,so unfair
630,anger,a away
631,anger,rel  the wednhe is now gone
632,anger,i don't want to i want  jis jowe
633,anger,la ong landlord a jelly of te monicas to lly somlat their grandmother's apartment
634,anger,ca acao what is wron with my sogg
635,anger,
636,anger,s
637,anger,i can't prove o yinne what i do you'll be going chaic for murder
638,anger,
639,anger,o  nod
640,anger,i do a mate a  maaaaere a ow
641,anger,won ye follow me
642,anger,me
643,anger,noan nansy the by
644,anger,iney a  a os an ow l ijus make o  ye foo
645,anger,i maged all the way l we
646,anger,jo mod un te tar fory rout larger
647,anger,in tell like know you an more man
648,anger,it ce long alo
649,anger,e of o
650,anger,a anas i can do ita
651,anger,an veil  looping a te diigan cunching i
652,anger,like thap sailor the wen you picked is gone ans go for
653,anger,ee shvises of do everydi ata
654,anger,ten a bleas on mat osryn to pressure you te mou mate you just no very rigo r
655,anger,gon b the shall say such o tar my
656,anger,e pik wa just kit wa hare of abour
657,anger,so i giv lot tostumple a ro e  leslep it th irsi  m er
658,anger,when the meesis i ds sol that ta t fousand fogs
659,anger,shuld i it me e a  o
660,anger,et so ri
661,anger,
662,anger,pepicios  interested in you thats herd and i have linsa to words etot  is  e silenty bot wen note o
663,anger,did you or go me the massa
664,anger,
665,anger,i amsoi
666,anger,no it was weni sidn a fir  ta now atsd on i so  teri an i ver
667,anger,niinor san my bod
668,anger,idi not diwaistotogether odis loii
669,anger,ia pling het him
670,anger,maa
671,anger,so i  still i ge idea what i'd say by do he's thinking girl id do er two
672,anger,so you war ogay
673,anger,oa aey  portunately i don't see sad
674,anger,how  he was tead who were bato at ters in at o man gila stenting
675,anger,toinw
